text,kelas
cimahi hayang cimbuleuit pan kota bapak naha ciumbuleuit mati lampu bapak,0
jumat sudah ayo ah menggoes bareng hahahahhahah,1
hayu wargi bandung tiasa sarumping mangga ramekeun jalan bandung dinten ieu aku,1
diri taman jomblo bandung ridwan kamil agung dewa jomblo,1
siapa yang jaga siapa yang pelihara kalau rusak kaya begini siapa yang tanggung jawab,0
tetot fera sudah punya sim bapak fera tidak punya sim tapi sudah jalan bapak pagi pagi depan pasar uber,1
beliau lahir pagerageung ti tasik bapak good bye grandpa you will be missed,1
busy at sir what doa you say kababayan in english,1
walikota dengan program biopori saurna kbb plesir hongkong cari bibit cakar langit bade pelak cihideung kitu,1
bapak fera tidak punya sim tapi sudah jalan bapak pagi pagi depan pasar ujungberung suka macet sama dagang pinggir,0
kelurahan sukamaju cimanggis depok urus surat jamsostek hampir bulan belum dapat tandatangan lurah alasan sedang umroh aneh,0
bapak kapan bandung karya bapak rindu diri,1
pagi bapak tinjau empat supratman anak kecil ngemis ibu tunggu setor pom bensin terima kasih bapak,1
walikota bandung lantik elih sudiapermana,1
bapak kagum bapak,1
bapak pagi pagi depan pasar ujungberung suka macet sama dagang pinggir jalan benah bapak ganggu kendara,0
bangga teu bapak teater anak ekonomi bandung jadi hiji hijina isi acara stai madura,1
lanjut bapak,1
cayoo sukses orang walikota tidak bawa persib juara sukses orang walikota tidak bawa persib juara status photo,0
cinta itu,1
bapak sebab celaka teh sanes jalan nu lubang wae eta angkot lamun belok sok tara make sent tah bapak maen belok saenakna,1
coba bapak jalan rajalwali timur pasar andir pagi hari,1
jalan buah batu dekat tol lubang cukup bapak kemarin banyak mobil ngerem dadak,0
bapak,1
gas terus jalan raya sudah gitu buat kereta parahyangan mau berangkat tunggu dulu ah gila harus aku jadi istri ridwan kamil,0
malam lewat paspati sengaja ingin liat yang kata warna ini keren sangat terima kasih bapak buat bandung jadi lebih warna,1
kirim proposal balaikota kalau undang bapak ibu acara seminar cara bagaimana,1
bandung smart city proyek apa saja bapak today meeting dengan dutch delegation for cont,1
walikota bandung canang tahun,1
kalau hujan hari alias banjir not gong xi fat chai but ayo ngung xi choi,0
sami sami abah nuhun ridwan alah siah tos lam geningan sok doakeun sing,1
nuhun ridwan alah siah tos lam geningan sok doakeun sing gerak cageur,1
turut dukung bangun bandung rt belanda tindak lanjut kunjung ridwan,1
bapak mohon izin saya desain tshirt tentang program kerja bapak buat ikut lomba design teu sawios,1
wkwkwk busy at sir what doa you say kababayan in english,1
wihh belanda tarik program kota pintar bandung,1
kalau pipi sampe sekarang kenapa chubby terus bapak bapak nahanya wayah kieu sok lapar,1
ayo sekolah bis sekolah kota bandung hino rs celcius foto,1
good advance for this beloved city today meeting dengan dutch delegation for bandung smart city project,1
haha saja kamu terima kasih saya ajar dari walikota bandung ridwan kamil,1
bapak disdik bandung kurang ramah dalam layan masyarakat umum sering dalam kerja tugas coba tegur bapak,0
jalur koordinasi surat disdik kota bandung disdik provinsi jawa barat contoh disdik provinsi banten,1
gubernur kaltim awang faroek walikota bandung sukses raup dana csr eropa,1
anjing pigking ndasmu anjing ridwan kamil deddy cont,0
ajar pungut biaya naik damri pada hari senin lapor via sms,1
zona merah teh tempat renti motor tea geuning zona merah itu saja bapak,1
temenin you dead bapak bahasa inggrisna jomblo teu payu payu nang taun taun naon,1
bapak nahanya wayah kieu sok lapar,1
most mungkin secara jiwa raga bandung asli banget akan beda jika jabat kota bandung jadi humanis,1
bapak butuh subsidi cinta bapak mohon bantu nuhun bapak,1
hahaha bhahaha lol busy at sir what doa,1
rumah bapak ridwan kamil buat ribu botol kratingdeng,1
wakil gubernur jawa barat sama walikota bandung hadir launching tim htt,1
bapak tidak tanggap satpam depan kantor bapak apa kasi bapak,0
assalamua laikum,1
bandung makin laju sama bapak jogja stuck makin kikis node,1
heuh bapak jalan jalan riau gedung sate belakang sampe cont,1
bapak mohon pindah tiang pln tengah jalan jln,0
bapak mau minta pendapat kena apartemen yang bangun bagus dago bapak apa mungkin kapasitas daerah pada,1
gerobak mie mercun unik lhoo bentuk langsung sms saja,1
tahun kota bandung jadi salah satu kota ram dunia dasar survei majalah time,1
folbck kartu keluarga,1
tantang pertama justru pada benah birokrasi moga beri mudah bapak siap bu,1
daerah bangbayang dago beneran jadi apartemen,1
bapak bakal musuh produsen mobil motor kampanye sepeda,0
kamis line up bukabareng baksos setiabudi sama anak yatim bapak ridwan kamil,1
bapak ridwan kamil apa kabar bapak,1
wilujeung sahur bapak emil mudah mudah shaumnya lancar aamiin,1
wilujeng saur bapak emil mugi alloh swt maparin barokah kango urang sadaya amiiin,1
hidup juang henti bismillah,1
allhamdulilah tah teu salah kan jadi walikota idam teh insya allah skatepark hadir tahun depan,1
tah teu salah kan jadi walikota idam teh insya allah skatepark hadir tahun depan,1
warga jadi harus bangun kota salah satu cara tiada keluh,1
sayang sekali bukan urng tarling malam masjid as syifa rw cijambe ujung berung,1
bukan urng tarling malam masjid as syifa rw cijambe ujung berung,1
selamat istirahat kawan suatu hari semua pulang,1
bandung bagaimana video ktp seleksi pedagang kaki lima ibukota,0
lagi benah,1
rawan gempur bandung bapak tempat tinggal saya rw sebut,1
karena butuh ekonomi milik tanah alih fungsi bapak beri solusi bapak terima kasih,1
masyarakat solat ied tempat main anak perlu masyarakat jual yang milik hak atas tanah tersebut,1
bapak daerah kiaracondong lurah kebonjayanti rw belakang polisi sektor kiaracondong bidang tanah yang biasa guna,1
goodluck mas emil for today,1
segera selamat istirahat kawan suatu hari semua pulang,1
ridwankamil asa tidak pernah dengar program perintah buat sejahtera gelandang,0
wah euy asli skandal segera buku bapak ajak sare tah bapak sama bella,1
yaah sudah mulai dik pdahal masih baru yaa pemerintah kota tidak bantu bagaimana nasib hiks,0
bapak emil langkah awal urai macet daerah sub urban seperti ujungberung seperti apa saya harap solusi yang solutif,0
waduh sudah kena sekarang,1
bapak selamat malam masalah bersih paling utama utama bersih organisir hasil untung,1
sami sami mung ka anjeunna allah sadaya urus mulang taya pis lolongkrang manusa takabur dina getak hirup kahirupannana,1
supaya seperti beliau jam begini enak poin akun twitternya,1
pulang akhir kali moga jejak ilmu baik bersih lekat bandung insha allah,1
waduh,0
rt selamat istirahat kawan suatu hari semua pulang,1
selamat rehat bapak selamat istirahat kawan suatu hari semua pulang,1
bapak punten selamat istirahat kawan suatu hari semua pulang,1
saat yang muda yang bicara yang tua istirahat bapak,1
pasar baru jablay banyak kok berani tutup saritem bapak,0
moga jadi teladan usia yang tahu,1
sih fisik kota dulu proses rancang supaya pesan kota orang bersih,1
selamat istirahat bapak walikota keras pilwali lewat moga kerja keras tahun depan lancar berkah,1
selamat istirahat bapak,1
selamat istirahat kawan suatu hari semua,1
bapak slaku laku ukm mula rasa berat kalau masih baru jalan sudah berat dengan pajak resto mohon hati,1
buat bapak moga amanah masyarakat cinta kota bandung jaga jaga,1
bapak tidur bapak emil banyak benah besok hari,1
konsep kembang ekonomi kreatif kota,1
bandung macet kalau tidak solusi kongkrit pergi kantor setelah subuh,0
yah kalau bapak tidak jadi walikota coba jadi anggota dprd kota bandung saja suara lebih keras pemerintah kota,1
mirip ramai media tapi pas pilkada jadi karena calon kuat,1
bandung segala kenang buat yang jauh apa yang buat kamu kangen bandung,1
haiya ceuk saha oeh siga ahok,0
bandung buat yang jauh apa yang buat kamu kangen bandung,1
ridwan kamil,1
mantap bapak ridwan kamil tambah percaya diri maju pemilihan wali kota,1
sila periksa sebar alas men jr uu dikti,1
sepakat bapak buat yang jauh apa yang buat kamu kangen bandung,1
rc have fun go mad dulu kalau waktu aceh nama tgif bulan sekali main musik,1
woow rt apa yang buat kamu kangen bandung,1
makan jajan lumpia basah mie dorokdok sambel cibiuk mie kocok duh semua,1
fashion,1
naik angkot sampe motor bergps bareng buat yang jauh apa yang buat kamu kangen bandung,1
simpang dago bisa makan apa saja kapan saja jam buat yang jauh apa yang buat kamu kangen bandung,1
minggu pagi bandung bapak buat yang jauh apa yang buat kamu kangen bandung,1
atmosfer kalau rumah ibarat minimal riah haha buat yang cont,1
rumah serta isi,1
sami sami terima kasih buat temen temen sudah diskusi seru bareng bapak,1
cimol semua aspek buat yang jauh apa yang buat kamu kangen bandung,1
kosan geger kalong kangen jaman kuliah duit pas pas warteg cimol,1
anak istri ujungberung dengan backdrop gn manglayang buat yang jauh apa yang buat kamu kangen bandung,1
teman taman buat yang jauh apa yang buat kamu kangen bandung,1
ins bandung bersih hijau bunga buat yang jauh apa yang buat kamu kangen bandung,1
bandung kangen suasana kenang,1
jalan tertib macet pohon rindang banjir kali bersih kota kembang,1
manuk cingcuing buat yang jauh apa yang buat kamu kangen bandung,1
kreatifitasnya saja buat yang jauh apa yang buat kamu kangen bandung,1
suasana sama semua lah buat yang jauh apa yang buat kamu kangen bandung,1
suasana hangat sama tengah dingginya bandung buat yang jauh apa yang buat kamu kangen bandung,1
saung bapak udjo,1
kuliner tempat kuliner,1
suasana sejuk malam hari,1
air dingin buat yang jauh apa yang buat kamu kangen bandung,1
udara nyaman yang dulu buat yang jauh apa yang buat kamu kangen bandung,1
makan buat yang jauh apa yang buat kamu kangen bandung,1
suasana buat yang jauh apa yang buat kamu kangen bandung,1
banyak bapak makan suasana tempat main jalan jalan tempat sejarah ah pokokna seeur pis,1
suasana,1
buat kangen bandung hawa sejuk jajan,1
buat yang jauh apa yang buat kamu kangen bandung,1
macet buat yang jauh apa yang buat kamu kangen bandung,1
bandung bersih hijau bunga buat yang jauh apa yang buat kamu kangen bandung,1
bahkan karakter tidak jawab buat yang jauh apa yang buat kamu kangen bandung,1
bapak apa konsep besar bapak bawah bandung,1
cemilan cemilan na na buat yang jauh apa yang buat kamu kangen bandung,1
buat yang bandung apa sih yang buat tidak ninggalin bandung,1
angkot kuliner saudara juang buat yang jauh apa yang buat kamu kangen bandung,1
dulu iya sekarang mah tau buat yang jauh apa yang buat kamu kangen bandung,1
bau tanah kala hujan orang murah senyum ieu wungkul weh bapak,1
semua buat yang jauh apa yang buat kamu kangen bandung,1
semua isi kota orang orang buat yang jauh apa yang buat kamu kangen bandung,1
anak semarang kuliah uns main itb sudah cukup bwt slalu kangen main sana lagi bapak,1
lumpia basah ma monumen du hehehe buat yang jauh apa yang buat kamu kangen bandung,1
adem alami buat yang jauh apa yang buat kamu kangen bandung,1
kangen peuyeumpuannya buat yang jauh apa yang buat kamu kangen bandung,1
cup bahan kertas daur sampah du sampahbiasa,1
ridwan kamil beri sanksi dagang guna styrofoam,1
rutinitas para petugas beres gps wilayah,1
ridwan kamil beri sanksi dagang guna styrofoam ridwan kamil beri sanksi dagang guna styrofoam,1
musda bkprmi kota bandung,1
entah ngefans entah sering liat poster bapak sudah malam mimpi terus bapak,1
mas fadjroel mau ngomong tidak macam dulu,1
harus yang langgar gsb bongkar apalagi tidak liat plang imb,0
kartar serta anak anak,1
timbun sampah per an astina psr pamoyanan sudah bersih terima kasih bapak walikota pis,1
nah kamu meme dukung ahok edar ridwan kamil yenny wahid ban bukan ucap,1
hai tweeps datang yah sore malam hari acara sukasari culinary night jalan rintis srjadi don miss itu seeuthere,1
fitnah kotor ahoker ridwan kamil yenny wahid bantah meme dukung ahok,0
warga skly maghrib kaji tanam jiwa bersih sejak,1
nah kamu meme dukung ahok edar ridwan kamil yenny wahid ban bukan ilustrasibel,0
tah benar bapak hehe,1
waktu sekarang putus jadi orang pensiun preneur sukses ingat now or never,1
ajar dulu ayo ppst edisi mil selalu jadi orang ajar,1
assalammulaikum selamat pagi sukses hari bismillah,1
akun kata catut nama ridwan kamil yenny wahid dukung suara muhamma,1
periksa tulis dahlan iskan bapak waktu jadi tri bumn bahas bawah unit prestasi kerja luar biasa,1
ridwan kamil ajak siswa sepeda makan siang rumah dinas ridwan kamil ajak siswa sepeda makan siang rumah dinas,1
ridwan kamil protes nama catut dukung ahok,1
rajin bike to school ajar sepeda ridwan kamil rajin bike to school ajar sepeda ridwan kamil,1
keren puri kranji regency,1
urban farming,1
mapay lembur rw,1
garden ditrsan bubat,1
bestari cikapundung kolot,1
masa depan pulau jawa kira kira bakal bagaimana kalau kaya begini,0
pimpin usia tua biasa gaptek bapak pikir twitter aplikasi adalah musuh kaya dulu angkut online,0
suka video ridwan kamil penuh cinta hitam putih oktober full,1
ridwan kamil yenny wahid catut meme dukung ahok,0
sharakhah banget mah musti kaji ulang peraturan daerah selenggara rw tidak sigana mah wajib,1
malam makin sunyi hati gerak untuk tanya share alat fotografi bapak inisial juga kalau khwatir sebut merk,1
surat himbauan kelurahan kecamatan terus rw benah dulu pondasinya baru indah muka,0
alhamdulillah bapak produk awal jual pakai paper cup khusus makan,1
lapor bapak kakek status,1
benar bapak andi bilang pajak bumi bangunan bayar per kartu keluarga bahaya ini tanda akhir jaman,1
liat via televisi od cerita inspirasi bangga punya bapak kaya begini,1
tidak sekali pakai foto albert einstein hhaha,1
bapak emil mungkin sangka orangtuanya upin ipin bapak,1
sosialisasi saja tidak usah tanya lokasi beri suluh kecamatan kelurahan mutlak patuh rw kelompok linmas jahil,1
lucu ini orang,0
info mayor ridwan kamil is banning styrofoam food packaging from bandung,1
ridwan kamil is banning styrofoam food packaging from bandung,1
ridwan kamil protes catut meme dukung ahok,0
mau ngamen jual asong jalan sekarang boleh,1
kenapa daerah pernah bantu peser buat lancar pesta rakyat sambut merdeka republik indonesia,0
kata perintah beri biaya besar buat karang taruna lurah,1
formasi baik persib mata ridwan formasi baik pernah milik persib versi bapak emil,1
formasi baik persib mata ridwan kamil,1
okezonenews formasi baik persib mata ridwan kamil status,1
ccin buyungkiu ridwan kamil risma aher ganjar karwo banyak kada yang bahasa santun namun tidak korupsi,1
assalammualaikum punten bade tumaros bapak bu perkawis sekolah smp negeri yang mau terima murid pindah gratis,1
baik persib mata ridwan formasi baik pernah iaxmur,1
ridwan kamil risma aher ganjar karwo banyak kada yang bahasa santun namun tidak korupsi kerja bagus status,1
ridwan kamil janji bonus persib juara piala bhayangkara kamil janji bonus persib juara piala,1
ridwan kamil final piala bhayangkara tetap gbk,1
ayo dukung bangun pesantren kreatif dengan wakaf dompet ihaqi peduli desain pesantren by,1
lha koq,0
assalammulaikum selamat pagi sukses hari bismillahirrahmanirrahim aheryawan,1
ridwan kamil final piala bhayangkara tetap gbk walikota bandung ridwan kamil ingin final piala,1
ridwan kamil galau tonton persib dinas luar negeri,1
jalan santai warga dalam hari ulang tahun republik indonesia,1
tempat sampah yang tidak jadi bingung malam buang sampah he he sekarang luas arcamanik sudah tidak,1
abang hhahaa bapak kapan cicadas culinary night,1
juang masa baksil jadi tempat pembuangan sampah mohon ridwankamil,0
bersih dago perlu tiru ini,1
kereta patas stasiun cimekar lebih menit yang mau upacara resah bapak xixixi jadwal,0
bapak sistem gps gerak pungut sampah laku sekolah masing kan nah gps hanya laku area skolah luar,1
suasana yang kurang aman masih banyak kendara lintas mohon bantu,1
bapak indonesia ultah dong bapak,1
selamat pagi bapak kemarin sekolah ada giat gerak pungut sampah beberapa foto,1
satu buat,1
senirajawali hasil kolaborasi seniman,1
isi merdeka budaya buang sampah tempat selamat pagi bapak bantu,1
nk pernah kibar bendera merah putih kota bandung asal cianjur selatan,1
terima kasih bapak atas baik jalan maranata sekarang road hehe,1
bapak kapan cicadas culinary night,1
kata bapak indonesia surga indah sarat masalah karnanya cinta negeri dengan aksi solusi dirgahayu indonesia,1
via raya merdeka republik indonesia dengan tidak sampah kurang sampah,1
bapak rangka merdeka kaya bagus kalau lomba,1
this is thing in my city now ref tapi,1
kab kota salahsatunyakotabandung turut meriahkanacarahelaransenibudayadlmrangkahut,1
bapak kakak perempuan ulangtahun cepat pulang kakak perempuan mau ucap ulangtahun sama bapak,1
selamat hari ulang tahun republik indonesia indonesia merdeka semoga rakyat sejahtera bandung juara,1
bapak punten teu tiasa ngiringan upacara kumargi piwarang damel aku atas punten pis bapak sateuacana ulan we atas abi,1
jalan depan astana baru rusak sedikit padahal mah bapak aduh serasa lewat jalan dusun pinggir kota,0
kakak perempuan teh mau ucap sama ridwan bapak aku,1
juta aduh bagaimana juragan ini lokal cetak juragan coba tanya sama sm brodexin yang papatong saja juragan,1
ayo siap simak cerah guru kiyai,1
seniman rajawali akan tolak pedagang kaki lima,1
senimanhelaranrajawali turutmeriahkanacaramilangkala esok sama kota kab lain,1
gasibu moal bapak loh,1
rute kirab mohon maaf apabila jalan hambat infobdgevent,1
tweet aku cuma quote doang sama ridwan kamil tetep mention yang masuk banyak,1
terima kasih bapak ridwan kamil sudah mampir stand dengan pic,1
tonton livestreaming luncur kanal kpktv dialog dengan ahok risma ridwan kamil,1
inna lillahi wa telah pulang rahmatulloh ket tapi pkk kelurahan padasuka kecamatan cibeunying kidul jam wib,1
sae bapak tuntaskeun heula ngawangun kota bandung beres nembe ngiring icikibung jempol kanggo bapak walikota,1
narsis bapak,1
situasi depan gedung sate,1
bapak aku,1
bapak dong kaya begini ganjar pranowo marah sidak kuman negara mem,0
buat dari,1
mantepp bapak erwinmadmoron merdeka inisoenda,1
canang gerak sholat shubuh jamaah mesjid alun alun bandung,1
gerak subuh jamaah sama bapak wali kota serta jajar,1
live ridwan kamil laksana salat subuh,1
cang gerak shalat subuh jamaah kota bandung mesjid raya jawa barat,1
syukur semoga depan semua kebun binatang indonesia lagi jumpa kasus,0
ridwan kamil meski sering tengil tapi bisa jaga marwah wibawa sebagai walikota baik hadap warga maupun terjadap pegawai negeri sipil yang pimpin,1
cari solusi yang santun untung pihak yang rugi moga allah swt beri yang baik,1
dengan berita hoax bohong produksi lama,1
asli kalimantan ini harus lindung jangan abai begini wahai bapak menteri,0
buat gua orang depan umum seperti gitu mau ahok mau ganjar pranowo mau cumi cola sama saja tiru ridwan kamil status,0
gerak subuh jamaah jan,1
dapat arah bapak wali canang subuh jamaah kota bandung tapi kunaon paling ingat nasi timbel,1
arah bapak walikota ramai dengan subling,1
giat lounching gerak subuh jamaah,1
hopes itu will better if should be take care by goverment but if itu know how to take raeady to be vol,1
kalimat baik diam ridwan kamil,1
barakallahu fiik bapak,1
selamat pagi,1
canang shubuh jamaah lurah mesjid agung bandung,1
giat launcing gerak laksana shalat subuh ridwankamil,1
punteun bapak emil angkot kircon terlalu banyak henti pedagang kaki lima semrawut kendara motor susah lewat klakson diam,0
siap siap ini bapak bismillah ayo,1
ridwan kamil mayor of save the animals of bandung zoo indonesia sign the petition ridwan kamil mayor of bandung save the animals of bandung zoo indonesia recruiter twitter via,1
ridwan kamil curhat facebook soal bonbin beruang kurus,0
sosialisasi shalat shubuh jamaah masjid urus ulama,1
ridwankamil,1
bapak mohon periksa lampu pju jalan panca tengah raya padam lama padam,1
this popped up on facebook and immediately thought of bandung if funds are required to help the bears let work together,1
kalau bukan sekarang kapan kalau bukan siapa hehahahahahah,1
that so nice of you to say but he did all the hard work,1
bapak ridwan boleh email,1
hidup sekali jangan tua karya inspirasi ridwan kamil,1
semakin banyak yang campaign macam begini bagus,1
karena kalau tidak wacana begini secara blow up yang luas mungkin tidak akan pernah mulai subuh brjamaah sekedar manfaat sosmed begitu,1
memang kalau liat sisi seperti pamer ibadah tapi tengah kondisi muslim sekarang yang mungkin sudah gitu jarang subuh jamaah bagus,1
mungkin supaya pantau saja kalau tingkat sampai subuh tiap hari arti gerak hasil karena sudah jadi biasa,1
kalau aku lebih pilih presiden,1
terima kasih bapak wali assalamualaikum,1
lah yang percaya allah untuk lindung dari segala bentuk aniaya bahkan yang laku perlahan,1
rasa malu malu karena peluk agama yang paling sempurna tapi sering abai supaya zalim depan mata,0
murak tumpeng atas berkah usia ketua kartaranum wilujeng barokah,1
karena walaupun mnyelamatkn ekor hewan tapi selamat bagi dari keluarga mereka sendiri masya allah harus,1
selamat ekor hewan begitu haru bahkan sentuh bagi dalam nurani,1
tanam sifat kasih sayang yang lebih kepada umat isa as bukti sering lihat sifat sifat mulia heroik,1
sebagai orang islam aku karena tersebut telah sebut dalam kitab suci al quran yang bunyi,1
atau beri kb yang kelola nasrani yang mereka lebih sayang hadap banding orang islam sendiri,0
karena sudah sangat lapar bagaimana bapak siapa kira yang tutup kbb balik habitat mula,0
dengan kasus yang sama lihat beruang madu makan kotor sendiri,0
sekitar tahun yang lalu lihat tidak mampu dalam laku hewan,0
bapak kalau boleh usul kebun binatang bandung mending tutup bapak daripada puluh tahun tidak becus tetap jadi,0
jangan ngamuk,1
andai saja bapak jadi calon presiden bapak kalah,1
pimpin periksa dulu masalah jangan langsung ngamuk,1
kerja yang paling senang dunia hobi bayar ridwan kamil,1
pimpin bina organisasi ngamuk,0
mohon sangat depan hindar pimpin ngamuk,0
lebih sayang uang hutan ayo ikut mal nasinal ridwan kamil loh status photo,1
pasar kosambi bandung tidak rawat,0
enak kirim link upload lalu twitter imel bapak,1
selamat pagi selamat jalan tugas untuk bapak ibu,1
manfaat air hujan bapak harap bapak lihat beri testimoni karya proyek bapak,1
ieu rek demo saritem dijadikeun pasar emas insansentanu demokeun ulah,1
tempat bapak,1
asyik dkt cibiru bandung timur malam bahagia sama,1
bapak bagaimana dadak kapolsek tidak kasih ijin teh,0
kalau panyileukan tidak bapak ridwan tempat teh,1
bahaya bapak tukang dagang main sekolah dasar deket rumah yang jual main jumanji bapak,0
wilujeng enjing selamat pagi semoga hari karunia tidak lupa tetap tertib jalan empat pada orang,1
tempat teh,1
warga bandung timur malam bahagia sama,1
cibiru apa panyileukan culinary night,1
obama jokowi ridwan kamil berkah jokowi ridwan kamil berkah,1
cibiru warga bandung timur malam bahagia sama,1
tutup pakai kardus,0
bapak mohon bantu warga bojongloa kaler hari air pdam alir rumah kurang air bapak,0
acara ngehalangin jalan pulang jadi tidak pulang hari,0
kalau bandung suruh hari kamis saja lyd kalau anak sg yang tidak bisa bahasa indonesia kan tidak bapak,1
jadi bakar coblong,0
periksa favorite teh nuhun bapak ai cibiru culinary night teh dimana tempat na bapak nuhun,1
terima kasih bapak buat datang kemarin moga jumpa lain waktu agenda ngaji bareng mungkin,1
bapak kalau tempat pembuangan sampah bungur tutup warga buang sampah mana deket nuhun infona,0
dahlan iskan ngamuk tol ridwan kamil kesal sampah,0
walikota bandung direktur utama launching logo pasar sae,1
kasusna angger keneh meuli gas angger eusina meunang nu tengah deui segel keneh,0
bapak mau usul salah satu syarat izin pedagang kaki lima sedia keranjang,1
tonton ayo karena sangat sarat dengan informasi,1
bakar kios jalan cihampelas sudah selesai unit damkar balik kanan mako,0
ridwan kamil keluar kartu pedagang kaki lima anti rentenir,1
ridwan kamil kartu pedagang kaki lima read bagi kartu pedagang kaki lima ridwan kamil upaya dagang bebas rentenir,1
publikasi dokumentasi jadi,1
yess salute lokalisasi saritem bandung bakal ubah jadi pasar emas,1
dinas bakar terjun unit pancar unit selamat,1
rugi rurut milik tahu taksir juta,0
asal mula api duga konseleting listrik jadi awal pukul,1
kaca wonkblog wp the solutions to all our problems may be buried in pdfs that nobody reads coba pdf,1
bakar hangus buah kios luas area,0
pagi yang hormat selamat kerja keras mlayani rakyat hidup sederhana kurang nikmat pribadi,1
malam pulang jakarta jam stop pasteur pintu tol bas amen mulai why,0
bapak camat tahu tidak pernah aktif tuch,0
jalan yunus tambah awal tahun bulan sudah hancur alas hujan,0
kendali bakar jalan cihampelas yang bakar kios samping hotel promenade aston,0
bagaimana bapak,1
tedxbandung ridwan kamil saving cities dengan urban,1
dengan selfie time,1
foto perhati ada pasca tanding persib vs persija mei lalu,1
we are smarter than,1
eks lokalisasi saritem jadi pasar emas ridwan kamil,1
negeri butuh banyak pemuda cari solusi bukan pemuda maki maki ridwan kamil,1
